[
  {
    "finding_id": "F-2026-006",
    "agent": "law_inspector",
    "timestamp": "2026-07-11T13:28:30.344595+08:00",
    "type": "程序违规",
    "severity": "低",
    "summary": "察隅县专项资金项目未发现明确的资金管理办法引用，需确认是否按规定执行",
    "entities": [
      "察隅县"
    ],
    "amount": 0,
    "confidence": 50,
    "evidence": [
      "7.10察隅台账 - （定）.xlsx"
    ],
    "law_refs": [
      "中央财政专项资金管理办法"
    ],
    "status": "未确认",
    "related_findings": [
      "F-2026-005",
      "F-2026-001",
      "F-2026-002",
      "F-2026-003",
      "F-2026-007",
      "F-2026-004"
    ]
  },
  {
    "finding_id": "F-2026-007",
    "agent": "law_inspector",
    "timestamp": "2026-07-11T13:28:30.344595+08:00",
    "type": "内控漏洞",
    "severity": "低",
    "summary": "项目数据分散在多个Excel文件中，未统一归档管理，存在内控风险",
    "entities": [
      "察隅县"
    ],
    "amount": 0,
    "confidence": 70,
    "evidence": [
      "7.10察隅台账 - （定）.xlsx",
      "察隅县汇总表.xls",
      "察隅县项目按乡镇分类.xlsx"
    ],
    "law_refs": [
      "会计档案管理办法"
    ],
    "status": "未确认",
    "related_findings": [
      "F-2026-005",
      "F-2026-001",
      "F-2026-002",
      "F-2026-003",
      "F-2026-006",
      "F-2026-004"
    ]
  }
]