[
  {
    "finding_id": "F-2026-001",
    "agent": "data_scout",
    "timestamp": "2026-07-11T13:28:30.344595+08:00",
    "type": "数据异常",
    "severity": "中",
    "summary": "察隅县台账7.10版资金汇总表有多个空金额字段，需核实",
    "entities": [
      "察隅县",
      "7.10察隅台账"
    ],
    "amount": 0,
    "confidence": 70,
    "evidence": [
      "7.10察隅台账 - （定）.xlsx"
    ],
    "law_refs": [
      "专项资金管理办法"
    ],
    "status": "未确认",
    "related_findings": [
      "F-2026-005",
      "F-2026-002",
      "F-2026-003",
      "F-2026-006",
      "F-2026-007",
      "F-2026-004"
    ]
  },
  {
    "finding_id": "F-2026-002",
    "agent": "data_scout",
    "timestamp": "2026-07-11T13:28:30.344595+08:00",
    "type": "财务异常",
    "severity": "中",
    "summary": "察隅县汇总表资金规模较大，需逐项核实资金拨付与使用进度匹配性",
    "entities": [
      "察隅县",
      "察隅县汇总表"
    ],
    "amount": 0,
    "confidence": 65,
    "evidence": [
      "察隅县汇总表.xls"
    ],
    "law_refs": [
      "专项资金管理办法"
    ],
    "status": "未确认",
    "related_findings": [
      "F-2026-005",
      "F-2026-001",
      "F-2026-003",
      "F-2026-006",
      "F-2026-007",
      "F-2026-004"
    ]
  },
  {
    "finding_id": "F-2026-003",
    "agent": "data_scout",
    "timestamp": "2026-07-11T13:28:30.344595+08:00",
    "type": "数据异常",
    "severity": "低",
    "summary": "察隅县项目按乡镇分类.xls未能解析，可能与文件格式损坏有关",
    "entities": [
      "察隅县"
    ],
    "amount": 0,
    "confidence": 50,
    "evidence": [
      "察隅县项目按乡镇分类.xlsx"
    ],
    "law_refs": [],
    "status": "未确认",
    "related_findings": [
      "F-2026-005",
      "F-2026-001",
      "F-2026-002",
      "F-2026-006",
      "F-2026-007",
      "F-2026-004"
    ]
  }
]